{
  "$schema": "https://json-schema.org/draft/2020-12/schema",
  "title": "WorkFile",
  "description": "Contents of data/works/<last character of id>/<id>.json: one work and its public logs. Unknown properties are allowed so that producers can add fields without breaking older generators.",
  "type": "object",
  "required": ["id", "type", "title", "path", "tags", "logs"],
  "properties": {
    "id": {
      "type": "string",
      "pattern": "^[a-z0-9]([a-z0-9-]*[a-z0-9])?$",
      "description": "Also the file name without .json. The file sits in the directory named by the last character of the id."
    },
    "type": {
      "type": "string",
      "description": "Media type. Known values: movie, tv, streaming, music, book, other. Unknown values are rendered as other."
    },
    "title": { "type": "string", "minLength": 1 },
    "path": {
      "type": "string",
      "description": "Directory path separated by \"/\", for example \"movies/2026\". May be empty."
    },
    "tags": { "type": "array", "items": { "type": "string" } },
    "status": { "type": "string" },
    "platform": { "type": "string" },
    "year": { "type": ["integer", "null"] },
    "creators": { "type": "array", "items": { "type": "string" } },
    "coverUrl": {
      "type": "string",
      "pattern": "^(https://.+)?$",
      "description": "An https URL, or an empty string."
    },
    "externalIds": {
      "type": "object",
      "additionalProperties": { "type": "string" }
    },
    "season": {
      "type": "string",
      "pattern": "^(\\d{4}-(winter|spring|summer|autumn))?$",
      "description": "Broadcast season, for example \"2026-autumn\" (winter: Jan-Mar, spring: Apr-Jun, summer: Jul-Sep, autumn: Oct-Dec). May be empty."
    },
    "episodeCount": {
      "type": ["integer", "null"],
      "minimum": 1,
      "description": "Total number of episodes, when known."
    },
    "logs": { "type": "array", "items": { "$ref": "#/$defs/LogEntry" } }
  },
  "$defs": {
    "LogEntry": {
      "title": "LogEntry",
      "type": "object",
      "required": ["id", "author", "loggedAt", "text"],
      "properties": {
        "id": {
          "type": "string",
          "pattern": "^[a-z0-9]([a-z0-9-]*[a-z0-9])?$",
          "description": "Unique within the work. Used as a URL segment."
        },
        "author": { "type": "string", "minLength": 1, "description": "Display name." },
        "loggedAt": { "type": "string", "pattern": "^\\d{4}-\\d{2}-\\d{2}$" },
        "rating": { "type": ["integer", "null"], "minimum": 1, "maximum": 5 },
        "text": { "type": "string" },
        "episode": { "type": ["integer", "null"], "minimum": 0, "description": "Episode number watched in this log." },
        "episodeEnd": {
          "type": ["integer", "null"],
          "minimum": 0,
          "description": "Last episode when one log covers several; ignored unless greater than episode."
        },
        "subtitle": { "type": "string", "description": "Episode subtitle. May be empty." },
        "program": {
          "anyOf": [{ "$ref": "#/$defs/ProgramInfo" }, { "type": "null" }]
        }
      }
    },
    "ProgramInfo": {
      "title": "ProgramInfo",
      "type": "object",
      "required": ["channel", "date"],
      "properties": {
        "channel": { "type": "string" },
        "date": { "type": "string", "pattern": "^\\d{4}-\\d{2}-\\d{2}$" },
        "start": { "type": "string" },
        "end": { "type": "string", "description": "HH:mm. May be empty." },
        "title": { "type": "string" },
        "source": { "type": "string", "description": "Where the program info came from, for example \"nhk\" or \"manual\". May be empty." },
        "url": {
          "type": "string",
          "pattern": "^(https://.+)?$",
          "description": "An https URL of the official program page, or an empty string."
        }
      }
    }
  }
}
